{
  "$schema": "../../schemas/rbac-target-state.schema.json",
  "schemaVersion": 1,
  "tenantId": "11111111-1111-1111-1111-111111111111",
  "scopes": [
    {"id": "/subscriptions/22222222-2222-2222-2222-222222222222", "includeDescendants": true}
  ],
  "assignments": [
    {
      "principalId": "aaaaaaaa-aaaa-aaaa-aaaa-aaaaaaaaaaaa",
      "principalName": "Platform readers (synthetic group)",
      "roleDefinitionId": "acdd72a7-3385-48ef-bd42-f606fba81ae7",
      "roleName": "Reader",
      "scope": "/subscriptions/22222222-2222-2222-2222-222222222222",
      "justification": "Approved platform visibility; replace these synthetic identifiers."
    }
  ],
  "roleDefinitions": []
}
